{
  "metadata": {
    "schemaVersion": "1.0.0",
    "createdBy": "USR-001",
    "createdAt": "2026-06-21T17:23:12Z",
    "lastUpdated": "2026-06-21T19:35:00Z",
    "projectType": "Microservices",
    "domain": "Matrimonial",
    "boardVersion": "1.0.0"
  },
  "project": {
    "id": "9a26c124-b363-45b6-9358-5c0b0d143422",
    "name": "MatrimonyApp",
    "shortName": "MAT",
    "description": "A trust-focused matrimonial application with a React frontend and microservices backend.",
    "status": "Active",
    "ownerId": "USR-001",
    "startDate": "2026-06-21",
    "targetRelease": "REL-001",
    "tags": [
      "React",
      "Microservices",
      "Neumorphism"
    ]
  },
  "participants": [
    {
      "id": "USR-001",
      "name": "Antigravity (AI PM)",
      "email": "pm@matrimony.app",
      "role": "Product Owner",
      "avatar": "avatar-1.png",
      "active": true,
      "bg": "#E0E5EC",
      "color": "#6C63FF"
    },
    {
      "id": "USR-002",
      "name": "Lead Frontend Developer",
      "email": "frontend@matrimony.app",
      "role": "Frontend Developer",
      "avatar": "avatar-2.png",
      "active": true,
      "bg": "#E0E5EC",
      "color": "#38B2AC"
    },
    {
      "id": "USR-003",
      "name": "Lead Backend Developer",
      "email": "backend@matrimony.app",
      "role": "Backend Developer",
      "avatar": "avatar-3.png",
      "active": true,
      "bg": "#E0E5EC",
      "color": "#8B84FF"
    }
  ],
  "initiatives": [
    {
      "id": "INIT-001",
      "projectId": "9a26c124-b363-45b6-9358-5c0b0d143422",
      "title": "Build Matrimony Platform",
      "description": "Develop a complete, trust-focused matchmaking ecosystem with a React frontend and microservices backend.",
      "status": "Active",
      "ownerId": "USR-001"
    }
  ],
  "epics": [
    {
      "id": "EPIC-001",
      "initiativeId": "INIT-001",
      "title": "Level 1 \u2014 Foundation MVP",
      "description": "Establish the minimum functional experience: authentication, basic onboarding, partner preferences, photo manager, search discovery, and interest exchange.",
      "priority": "High",
      "status": "In Progress",
      "storyPoints": 113,
      "ownerId": "USR-001",
      "labels": [
        "MVP",
        "Level-1"
      ]
    },
    {
      "id": "EPIC-002",
      "initiativeId": "INIT-001",
      "title": "Level 2 \u2014 Trust & Engagement",
      "description": "Implement credentials verification badges, saved searches, in-app messaging, visitor tracking, and block/report moderation tools.",
      "priority": "Medium",
      "status": "To Do",
      "storyPoints": 60,
      "ownerId": "USR-001",
      "labels": [
        "Engagement",
        "Level-2"
      ]
    },
    {
      "id": "EPIC-003",
      "initiativeId": "INIT-001",
      "title": "Level 3 \u2014 Premium Matchmaking",
      "description": "Introduce monetization mechanics via subscriptions, smart recommendations, profile boosts, and compatibility scores.",
      "priority": "Medium",
      "status": "To Do",
      "storyPoints": 80,
      "ownerId": "USR-001",
      "labels": [
        "Monetization",
        "Level-3"
      ]
    },
    {
      "id": "EPIC-004",
      "initiativeId": "INIT-001",
      "title": "Level 4 \u2014 Intelligence & Rich Interactions",
      "description": "Incorporate automated Selfie & Govt ID verification, video profiles, secure voice/video calling, and AI conversation suggestions.",
      "priority": "Low",
      "status": "To Do",
      "storyPoints": 100,
      "ownerId": "USR-001",
      "labels": [
        "AI-Safety",
        "Level-4"
      ]
    },
    {
      "id": "EPIC-005",
      "initiativeId": "INIT-001",
      "title": "Level 5 \u2014 Ecosystem & Expansion",
      "description": "Add an AI Matchmaking Assistant, wedding services marketplace, relationship counseling resources, and regional community portals.",
      "priority": "Low",
      "status": "To Do",
      "storyPoints": 120,
      "ownerId": "USR-001",
      "labels": [
        "Ecosystem",
        "Level-5"
      ]
    },
    {
      "id": "EPIC-FEAT-001",
      "initiativeId": "INIT-001",
      "title": "Feature: User Authentication (Multiple Methods)",
      "description": "Allows users to securely register and access the platform via Mobile OTP and Email Magic Links.",
      "priority": "High",
      "status": "To Do",
      "storyPoints": 19,
      "ownerId": "USR-001",
      "labels": [
        "Feature",
        "Auth",
        "MVP"
      ]
    },
    {
      "id": "EPIC-FEAT-002",
      "initiativeId": "INIT-001",
      "title": "Feature: User Profile Management & Editing",
      "description": "Multi-step wizard to create and edit matrimonial profiles capturing personal, family, academic, and lifestyle traits.",
      "priority": "High",
      "status": "To Do",
      "storyPoints": 19,
      "ownerId": "USR-001",
      "labels": [
        "Feature",
        "Profiles",
        "MVP"
      ]
    },
    {
      "id": "EPIC-FEAT-003",
      "initiativeId": "INIT-001",
      "title": "Feature: Partner Preferences",
      "description": "Configure preferences for age, height, community, languages, and location.",
      "priority": "High",
      "status": "To Do",
      "storyPoints": 8,
      "ownerId": "USR-001",
      "labels": [
        "Feature",
        "Preferences",
        "MVP"
      ]
    },
    {
      "id": "EPIC-FEAT-004",
      "initiativeId": "INIT-001",
      "title": "Feature: Profile Photos Manager",
      "description": "Manage profile images, primary avatar, and photo visibility controls.",
      "priority": "High",
      "status": "To Do",
      "storyPoints": 13,
      "ownerId": "USR-001",
      "labels": [
        "Feature",
        "Media",
        "MVP"
      ]
    },
    {
      "id": "EPIC-FEAT-005",
      "initiativeId": "INIT-001",
      "title": "Feature: Match Discovery (Search & Filtering)",
      "description": "Profile search, active filters, geo-location queries, and daily match scoring alerts.",
      "priority": "High",
      "status": "To Do",
      "storyPoints": 16,
      "ownerId": "USR-001",
      "labels": [
        "Feature",
        "Search",
        "MVP"
      ]
    },
    {
      "id": "EPIC-FEAT-006",
      "initiativeId": "INIT-001",
      "title": "Feature: Interest Management (Send / Accept / Reject)",
      "description": "Express interest, dashboard to manage received/sent states, and double-opt-in logic.",
      "priority": "High",
      "status": "To Do",
      "storyPoints": 16,
      "ownerId": "USR-001",
      "labels": [
        "Feature",
        "Interests",
        "MVP"
      ]
    },
    {
      "id": "EPIC-FEAT-007",
      "initiativeId": "INIT-001",
      "title": "Feature: System & Activity Notifications",
      "description": "Push, email, and in-app updates regarding interest updates and daily recommendations.",
      "priority": "Medium",
      "status": "To Do",
      "storyPoints": 11,
      "ownerId": "USR-001",
      "labels": [
        "Feature",
        "Notifications",
        "MVP"
      ]
    },
    {
      "id": "EPIC-FEAT-008",
      "initiativeId": "INIT-001",
      "title": "Feature: Basic Privacy Controls",
      "description": "Profile visibility settings, blur controls for non-matched profiles, and API gateway contact details masking.",
      "priority": "High",
      "status": "To Do",
      "storyPoints": 11,
      "ownerId": "USR-001",
      "labels": [
        "Feature",
        "Privacy",
        "MVP"
      ]
    }
  ],
  "stories": [
    {
      "id": "STORY-001",
      "epicId": "EPIC-FEAT-001",
      "title": "Mobile OTP Request UI & API Flow",
      "description": "Implement the mobile phone number input form in the login screen, with an API endpoint that generates a 6-digit OTP, stores it in Redis with a 5-minute TTL, and triggers the SMS gateway delivery.",
      "businessValue": "Critical - Initial point of entry and security boundary for serious seekers.",
      "priority": "High",
      "status": "Review",
      "storyPoints": 5,
      "assigneeId": "USR-002",
      "reporterId": "USR-001",
      "dueDate": "2026-07-15",
      "labels": [
        "Frontend",
        "Backend",
        "Auth",
        "REL-001"
      ],
      "acceptanceCriteria": [
        "Login screen renders a clean mobile number input conforming to standard E.164 formats.",
        "Submit button sends a POST request to '/api/v1/auth/otp/send' with phone number payload.",
        "Endpoint generates a random 6-digit OTP, saves phone number as key in Redis with 300 seconds TTL.",
        "SMS dispatch completes successfully or invokes a mock carrier callback for logging."
      ],
      "taskIds": [],
      "attachmentIds": [],
      "commentIds": []
    },
    {
      "id": "STORY-002",
      "epicId": "EPIC-FEAT-001",
      "title": "OTP Verification & Token Emission",
      "description": "Implement code verification form and backend validation logic which confirms the Redis OTP key, issues short-lived Access Token (JWT) and sets standard session cookies.",
      "businessValue": "Critical - Authenticates identity and unlocks the onboarding wizard.",
      "priority": "High",
      "status": "Review",
      "storyPoints": 5,
      "assigneeId": "USR-003",
      "reporterId": "USR-001",
      "dueDate": "2026-07-15",
      "labels": [
        "Frontend",
        "Backend",
        "Auth",
        "REL-001"
      ],
      "acceptanceCriteria": [
        "OTP verification overlay renders 6 numeric character inputs.",
        "POST request sent to '/api/v1/auth/otp/verify' containing phone number and OTP code.",
        "Server validates input matching active Redis record, signs HS256 Access Token, and registers active UserAccount in PostgreSQL.",
        "Success response returns HTTP-Only session tokens, redirecting user to Onboarding wizard."
      ],
      "taskIds": [],
      "attachmentIds": [],
      "commentIds": []
    },
    {